{
  "version": 1,
  "id": "cee289ccf7d0426cbf36b46d9a90ebe1",
  "title": "Undercover",
  "tags": [
    "Police",
    "Car",
    "Roads"
  ],
  "description": "An undercover police car heading down the motorway",
  "location": "UK",
  "capturedOn": "2026-05-31",
  "capturedAt": "2026-05-30T23:00:00.000Z",
  "camera": "sony-ilce-7m4",
  "lens": "tamron-28-200mm-f28-56-di-iii-rxd",
  "copyright": "© Reign of Tea. All rights reserved.",
  "uploadedAt": "2026-06-08T21:55:11.268Z"
}
