{
  "version": 1,
  "id": "d1d148363262423c962ce1737aa8ac6b",
  "title": "He's got a beard",
  "tags": [
    "Protest",
    "People",
    "Mask"
  ],
  "description": "Man covering his lower face, concealing identity",
  "location": "Birmingham, UK",
  "capturedOn": "2026-06-20",
  "capturedAt": "2026-06-20T12:00:00.000Z",
  "camera": "sony-ilce-7m4",
  "lens": "tamron-28-200mm-f28-56-di-iii-rxd",
  "collectionSlug": "britain-first-birmingham",
  "copyright": "© Reign of Tea. All rights reserved.",
  "uploadedAt": "2026-06-21T18:55:28.020Z"
}
