{
  "version": 1,
  "id": "f048f84e24f640b8a4e209c9913fc032",
  "title": "Love or Lowe",
  "tags": [
    "People",
    "Car"
  ],
  "description": "Rupert Lowe, leader of Restore Britain looks out of car at supporters",
  "location": "Ashton in Makerfield, UK",
  "capturedOn": "2026-06-13",
  "capturedAt": "2026-06-12T23:00:00.000Z",
  "camera": "sony-ilce-7m4",
  "lens": "tamron-28-200mm-f28-56-di-iii-rxd",
  "collectionSlug": "makerfield-day-of-action",
  "copyright": "© Reign of Tea. All rights reserved.",
  "uploadedAt": "2026-06-14T17:52:36.296Z"
}
