{
  "version": 1,
  "id": "7fb2fd19c7e44ce2b40cb20b9525e3c9",
  "title": "Flagged Up",
  "tags": [
    "Union Jack",
    "suit",
    "Flag",
    "People"
  ],
  "description": "Suited and booted, top to bottom with the Union Flag.",
  "location": "London, UK",
  "capturedOn": "2026-05-16",
  "capturedAt": "2026-05-15T23:00:00.000Z",
  "camera": "sony-ilce-7m4",
  "lens": "tamron-28-200mm-f28-56-di-iii-rxd",
  "collectionSlug": "unite-the-kingdom-may-2026",
  "uploadedAt": "2026-05-18T20:39:21.673Z",
  "blurHash": "UGEU=k$%KH?b~oxt%2-;oZx[Ses:V@xuf,M{"
}
