{
  "version": 1,
  "id": "ff6b41b572054bc1844cfb63085d0ddf",
  "title": "Slavery",
  "description": "Cult members subject to slavery and trafficking investigations.",
  "tags": [
    "Cult",
    "Protest"
  ],
  "location": "Crewe, UK",
  "capturedOn": "2026-05-09",
  "camera": "Sony Ilce 7m4",
  "lens": "tamron-28-200mm-f28-56-di-iii-rxd",
  "collectionSlug": "crewe-cult-protest",
  "blurHash": "UFEB?U~W%Mxu_N_3yD-:-px]?b-;?H-ptRX9"
}
