{
  "version": 1,
  "id": "a3d34cb397ba4c5ebb5f988f4fbbda9f",
  "title": "Break Out",
  "tags": [
    "Youtuber",
    "People",
    "Police",
    "Car"
  ],
  "description": "\"My Brakes Don't Work\" - Youtuber appears outside of police van.",
  "location": "London, UK",
  "capturedOn": "2026-05-16",
  "capturedAt": "2026-05-15T23:00:00.000Z",
  "camera": "sony-ilce-7m4",
  "lens": "tamron-28-200mm-f28-56-di-iii-rxd",
  "collectionSlug": "unite-the-kingdom-may-2026",
  "uploadedAt": "2026-05-18T20:39:21.673Z",
  "blurHash": "UJG7#qABPS$e7z=|H@S5Eg-oMxM{}ZJ7OrIo"
}
