{
  "version": 1,
  "id": "968f68941f6b44dea08a6c6d43784aaa",
  "title": "English Replacement",
  "tags": [
    "People",
    "Banner",
    "Remigration Now",
    "Flag"
  ],
  "description": "England flags pass by \"Stop White Replacement\" banner from 'Remigration Now'.",
  "location": "London, UK",
  "capturedOn": "2026-05-16",
  "capturedAt": "2026-05-15T23:00:00.000Z",
  "camera": "sony-ilce-7m4",
  "lens": "tamron-28-200mm-f28-56-di-iii-rxd",
  "collectionSlug": "unite-the-kingdom-may-2026",
  "sortOrder": 0,
  "uploadedAt": "2026-05-18T20:39:21.672Z",
  "blurHash": "UaIz}2x^K7#*_4s;%1aeo}VsxCae%2kqNexY"
}
