{
  "version": 1,
  "id": "547ac74e368a4d59b9f9e712b9730906",
  "title": "Made Up",
  "tags": [
    "People"
  ],
  "description": "A guy wearing makeup and outstanding jewelry at London Pride.",
  "location": "London, UK",
  "capturedOn": "2026-06-04",
  "capturedAt": "2026-06-03T23:00:00.000Z",
  "camera": "sony-ilce-7m4",
  "lens": "tamron-28-200mm-f28-56-di-iii-rxd",
  "collectionSlug": "london-pride-2026",
  "copyright": "Reign of Tea",
  "uploadedAt": "2026-07-07T17:31:16.972171Z",
  "blurHash": "UHC=rCt79]IpxZjZNHWB0~WC-Uxa9un%%1xu"
}
