{
  "version": 1,
  "id": "32460eb9ee5245e2b1a9146df93cd491",
  "title": "Proud Ned",
  "tags": [
    "People"
  ],
  "description": "YouTuber English Ned at London Pride 2026",
  "location": "London, UK",
  "capturedOn": "2026-06-04",
  "capturedAt": "2026-06-03T23:00:00.000Z",
  "camera": "sony-ilce-7m4",
  "lens": "tamron-28-200mm-f28-56-di-iii-rxd",
  "collectionSlug": "london-pride-2026",
  "copyright": "Reign of Tea",
  "uploadedAt": "2026-07-07T17:31:19.824008Z",
  "blurHash": "U39jDmm,00B;Oq9]sp;20LaL}toz^jnio#J-"
}
