{
  "version": 1,
  "id": "c3ce17dfce8e44f084c01b54b9157647",
  "title": "City Of Wells Train",
  "description": "The City of Wells locomotive waiting at Bury Bolton Street.",
  "tags": [
    "Trains"
  ],
  "location": "Bury, UK",
  "capturedOn": "2026-05-10",
  "camera": "Sony Ilce 7m4",
  "lens": "tamron-28-200mm-f28-56-di-iii-rxd",
  "blurHash": "UA8}A5WtwijE*0xbIXk6IpNHIVRhxbM{V?ad"
}
