{
  "version": 1,
  "id": "91166118988f4852901b4eccdd5e5c27",
  "title": "(H)ooded (H)ooligans",
  "tags": [
    "Police",
    "People",
    "Protest"
  ],
  "description": "'White Vanguard' members at protest.",
  "location": "Southampton, UK",
  "capturedOn": "2026-05-31",
  "capturedAt": "2026-05-30T23:00:00.000Z",
  "camera": "sony-ilce-7m4",
  "lens": "tamron-28-200mm-f28-56-di-iii-rxd",
  "collectionSlug": "southampton-henry-nowak",
  "copyright": "© Reign of Tea. All rights reserved.",
  "uploadedAt": "2026-06-08T21:55:11.268Z"
}
