{
  "version": 1,
  "id": "460222f5070143c78c9985ca40cc1fd2",
  "title": "Remigration Now Banner",
  "description": "A “Remigration Now” banner held up amongst protesters in Crewe.",
  "tags": [
    "Protest",
    "People",
    "Remigration Now"
  ],
  "location": "Crewe, UK",
  "capturedOn": "2026-05-09",
  "camera": "Sony Ilce 7m4",
  "lens": "tamron-28-200mm-f28-56-di-iii-rxd",
  "collectionSlug": "crewe-cult-protest",
  "blurHash": "U8B3{K%M00WBD%t7RjRj%MD%D%t7~q?bD%M{"
}
