{
  "version": 1,
  "id": "39990adb8f064e3ebb2528db6ba98c1d",
  "title": "Sir Robert Peel Statue",
  "description": "The Sir Robert Peel statue against a bright spring sky in the centre of Bury.",
  "tags": [
    "Statue",
    "Heritage"
  ],
  "location": "Bury, UK",
  "capturedOn": "2026-05-10",
  "camera": "Sony Ilce 7m4",
  "lens": "tamron-28-200mm-f28-56-di-iii-rxd",
  "blurHash": "UOBz^JXqIYj[_NIAMxt7bxIUa~oyM|Rjt7od"
}
