{
  "version": 1,
  "id": "96506e1dbef84759aacdd5de62136de9",
  "title": "Leave London",
  "tags": [
    "Roads",
    "Car"
  ],
  "description": "A tunnel exiting London.",
  "location": "London, UK",
  "capturedOn": "2026-05-16",
  "capturedAt": "2026-05-15T23:00:00.000Z",
  "camera": "sony-ilce-7m4",
  "lens": "tamron-28-200mm-f28-56-di-iii-rxd",
  "uploadedAt": "2026-05-18T20:39:21.672Z",
  "blurHash": "U69F$L}n139|0mEj-7o1}poLI=WVEj$#$hS4"
}
