{
  "version": 1,
  "id": "4196301efbe4426389e881b1a8d589f8",
  "title": "Canvas",
  "tags": [
    "People",
    "Sign"
  ],
  "description": "A canvasser for Restore Britain resting against a wall",
  "location": "Ashton in Makerfield, UK",
  "capturedOn": "2026-06-13",
  "capturedAt": "2026-06-12T23:00:00.000Z",
  "camera": "sony-ilce-7m4",
  "lens": "tamron-28-200mm-f28-56-di-iii-rxd",
  "collectionSlug": "makerfield-day-of-action",
  "copyright": "© Reign of Tea. All rights reserved.",
  "uploadedAt": "2026-06-14T17:52:36.296Z"
}
