{
  "version": 1,
  "id": "dd94e0185bf04f6a8fd1b3d165c5b1b6",
  "title": "Thousand Yard",
  "tags": [
    "Protest",
    "Police",
    "People"
  ],
  "description": "Police officer stares off into distance while surrounded and shouted at by protesting women",
  "location": "Birmingham, UK",
  "camera": "sony-ilce-7m4",
  "lens": "tamron-28-200mm-f28-56-di-iii-rxd",
  "collectionSlug": "britain-first-birmingham",
  "copyright": "© Reign of Tea. All rights reserved.",
  "uploadedAt": "2026-06-21T18:35:19.491Z"
}
