{
  "version": 1,
  "id": "7d06b4b35c5340589ce8cacfdf705131",
  "title": "Rad",
  "tags": [
    "People"
  ],
  "description": "Person showing devil horns at London Pride",
  "location": "London, UK",
  "capturedOn": "2026-06-04",
  "capturedAt": "2026-06-03T23:00:00.000Z",
  "camera": "sony-ilce-7m4",
  "lens": "tamron-28-200mm-f28-56-di-iii-rxd",
  "collectionSlug": "london-pride-2026",
  "copyright": "Reign of Tea",
  "uploadedAt": "2026-07-07T17:31:27.919376Z",
  "blurHash": "UIDSat-5lB-o_4xFS2of0xJVVWM|oJo~wvoL"
}
