{
  "version": 1,
  "id": "78de74e00bfd474d8da866eee12dcbbe",
  "title": "Crusaded",
  "tags": [
    "Protest",
    "People",
    "Flag"
  ],
  "description": "Man wearing Crusader costume surrounded by a sea of flags",
  "location": "Birmingham, UK",
  "capturedOn": "2026-06-20",
  "capturedAt": "2026-06-20T12:00:00.000Z",
  "camera": "sony-ilce-7m4",
  "lens": "tamron-28-200mm-f28-56-di-iii-rxd",
  "collectionSlug": "britain-first-birmingham",
  "copyright": "© Reign of Tea. All rights reserved.",
  "uploadedAt": "2026-06-21T18:55:28.020Z"
}
