{
  "version": 1,
  "id": "8d9c2f4f0efb41aa89f6227f14c6af0f",
  "title": "Proud Doggo",
  "tags": [
    "Animals"
  ],
  "description": "Dog seen at London Pride",
  "location": "London, UK",
  "capturedOn": "2026-06-04",
  "capturedAt": "2026-06-03T23:00:00.000Z",
  "camera": "sony-ilce-7m4",
  "lens": "tamron-28-200mm-f28-56-di-iii-rxd",
  "collectionSlug": "london-pride-2026",
  "copyright": "Reign of Tea",
  "uploadedAt": "2026-07-07T17:31:15.642739Z",
  "blurHash": "U79QHkr@9aw]^+%1IVaz^%I:9uxt~VIooyRj"
}
